{
  "schema_version": "0.1.0",
  "source": {
    "id": "matoe-temporal-handoff",
    "hash": "bcd888914d5a1884919802607607cba4a2938e4a2430c063656284ffdd5eced5",
    "title": "行事予定のお知らせ"
  },
  "actions": [
    {
      "id": "act_001",
      "kind": "event",
      "title": "遠足",
      "modality": "required",
      "actor": {
        "certainty": "unknown"
      },
      "temporal": {
        "type": "exact",
        "precision": "day",
        "date": "2026-10-15",
        "raw_text": "2026年10月15日",
        "alternatives": [
          {
            "type": "conditional",
            "precision": "day",
            "date": "2026-10-22",
            "raw_text": "雨天の場合は2026年10月22日",
            "condition": "雨天の場合"
          }
        ]
      },
      "evidence": [
        {
          "source_id": "matoe-temporal-handoff",
          "text": "遠足は2026年10月15日に実施します。\n雨天の場合は2026年10月22日に延期します。"
        }
      ],
      "inference": "explicit",
      "status": "proposed",
      "confidence": {
        "action": 0.95
      }
    }
  ],
  "receipt": {
    "extraction": {
      "provider": "fixture",
      "model": "design-handoff-fixture",
      "extractor_version": "design-handoff-1",
      "schema_version": "0.1.0",
      "created_at": "2026-10-02T00:00:00Z"
    }
  }
}
