{
  "schema_version": "0.1.0",
  "source": {
    "id": "matoe-design-handoff",
    "hash": "812dd7d2557e9d54cae893251b16363e47c9efe4d7058013946650cffb727094",
    "title": "参加票のお知らせ"
  },
  "actions": [
    {
      "id": "act_001",
      "kind": "reply",
      "title": "希望者のみ返信する",
      "modality": "required",
      "actor": {
        "certainty": "unknown"
      },
      "evidence": [
        {
          "source_id": "matoe-design-handoff",
          "text": "参加希望者のみ返信してください。"
        }
      ],
      "inference": "explicit",
      "status": "proposed",
      "confidence": {
        "action": 0.95
      },
      "conditions": [
        "参加希望者のみ"
      ]
    }
  ],
  "receipt": {
    "extraction": {
      "provider": "fixture",
      "model": "design-handoff-fixture",
      "extractor_version": "design-handoff-1",
      "schema_version": "0.1.0",
      "created_at": "2026-10-02T00:00:00Z"
    }
  }
}
